{
  "$schema": "https://json-schema.org/draft/2020-12/schema",
  "$id": "book_state.schema.json",
  "title": "Book State",
  "type": "object",
  "required": [
    "schema_version",
    "book_id",
    "current_chapter_id",
    "entity_registry",
    "entity_aliases",
    "active_relations",
    "relation_history",
    "object_history",
    "active_environment_constraints",
    "open_threads",
    "resolved_threads",
    "recent_context_digest",
    "state_checkpoint_id"
  ],
  "properties": {
    "schema_version": { "type": "string" },
    "book_id": { "type": "string" },
    "current_chapter_id": { "type": "string" },
    "entity_registry": { "type": "array" },
    "entity_aliases": { "type": "array" },
    "active_relations": { "type": "array" },
    "relation_history": { "type": "array" },
    "object_history": { "type": "array" },
    "active_environment_constraints": { "type": "array" },
    "open_threads": { "type": "array" },
    "resolved_threads": { "type": "array" },
    "recent_context_digest": { "type": "string" },
    "state_checkpoint_id": { "type": "string" }
  },
  "additionalProperties": false
}
