{
  "schema_version": "1.0",
  "book_id": "",
  "current_chapter_id": "",
  "entity_registry": [],
  "entity_aliases": [],
  "active_relations": [],
  "relation_history": [],
  "object_history": [],
  "active_environment_constraints": [],
  "open_threads": [],
  "resolved_threads": [],
  "recent_context_digest": "",
  "state_checkpoint_id": ""
}
